{
  "scorer_file": "llm-d-inference-scheduler/pkg/plugins/scorer/blis_weighted_scoring.go",
  "test_file": "llm-d-inference-scheduler/pkg/plugins/scorer/blis_weighted_scoring_test.go",
  "register_file": "llm-d-inference-scheduler/pkg/plugins/register.go",
  "scorer_type": "blis-weighted-scorer",
  "tekton_artifacts": {
    "values_yaml": "workspace/tekton/values.yaml",
    "pipeline_stubs": [
      "workspace/tekton/pipelinerun-noise.yaml",
      "workspace/tekton/pipelinerun-baseline.yaml",
      "workspace/tekton/pipelinerun-treatment.yaml"
    ]
  }
}
